{
  "$schema": "http://json-schema.org/draft-07/schema#",
  "type": "array",
  "items": {
    "type": "object",
    "properties": {
      "id": {
        "type": "string",
        "format": "uri"
      },
      "parent_id": {
        "type": ["string", "null"],
        "format": "uri"
      },
      "name": {
        "type": "string"
      },
      "languages": {
        "type": "array",
        "items": {
          "type": "string",
          "format": "uri"
        }
      },
      "articles": {
        "type": "array",
        "items": {
          "type": "object",
          "properties": {
            "id": {
              "type": "string",
              "format": "uri"
            },
            "name": {
              "type": "string"
            },
            "languages": {
              "type": "array",
              "items": {
                "type": "string",
                "format": "uri"
              }
            },
            "sections": {
              "type": "array",
              "items": {
                "type": "object",
                "properties": {
                  "name": {
                    "type": "string"
                  },
                  "word_count": {
                    "type": "integer"
                  }
                },
                "required": ["name", "word_count"]
              }
            }
          },
          "required": ["id", "name"]
        }
      }
    },
    "required": ["id", "name"]
  }
}
